{
  "arrival_seed": 51001,
  "checkpoint_hash": "0000000000000000000000000000000000000000000000000000000000000000",
  "controller": "ia2c",
  "demand_hash": "0000000000000000000000000000000000000000000000000000000000000000",
  "family": "peak",
  "generation_seed": 41012,
  "horizon_seconds": 3600,
  "manifest_hash": "0000000000000000000000000000000000000000000000000000000000000000",
  "method": "online_wce",
  "metrics": {
    "collisions": 0,
    "completed": 2700,
    "completed_trip_denominator": 2700,
    "completion_rate": 0.903010033444816,
    "inserted": 2990,
    "integrated_queue_vehicle_seconds": 433800.0,
    "mean_completed_departure_delay_seconds": 2.0,
    "mean_completed_time_loss_seconds": 140.0,
    "mean_completed_travel_time_seconds": 410.0,
    "mean_completed_waiting_time_seconds": 95.0,
    "mean_speed_vehicle_time_weighted": 8.4,
    "mean_total_queue": 120.5,
    "p95_total_queue": 210.0,
    "peak_total_queue": 250.0,
    "pending": 10,
    "remaining": 290,
    "scheduled": 3000,
    "speed_denominator_vehicle_seconds": 540000,
    "teleports": 0,
    "wall_seconds": 180.0
  },
  "network": "grid",
  "pilot": false,
  "policy_seed": 123456,
  "protocol_hash": "0000000000000000000000000000000000000000000000000000000000000000",
  "rollout_id": "0000000000000000000000000000000000000000000000000000000000000000",
  "rollout_index": 1,
  "sample_count": 3600,
  "scenario_hash": "0000000000000000000000000000000000000000000000000000000000000000",
  "scenario_id": "peak_1.5",
  "schema_version": 3,
  "source_commit": null,
  "split": "test",
  "status": "complete",
  "sumo_seed": 61001,
  "training_seed": 101
}
